{
  "$schema": "http://json-schema.org/draft-07/schema#",
  "$id": "https://int3gra.dev/schemas/connection.json",
  "title": "Connection Component",
  "description": "Describes a REST API connection — how to talk to a system and fetch or push data.",
  "type": "object",
  "required": ["id", "purpose", "request"],
  "additionalProperties": false,
  "properties": {
    "id":                { "type": "string" },
    "short_description": { "type": "string" },
    "purpose": {
      "type": "string",
      "enum": ["read", "write", "readwrite"]
    },
    "response_type": {
      "type": "string",
      "enum": ["json", "binary"],
      "default": "json",
      "description": "Expected response body format. Default: json. Use 'binary' for file downloads."
    },
    "body_type": {
      "type": "string",
      "enum": ["json", "binary", "multipart"],
      "default": "json",
      "description": "Request body format. Default: json. Use 'binary' for raw file upload, 'multipart' for form-data upload."
    },
    "binary_info": {
      "type": "object",
      "description": "Required when body_type is 'binary' or 'multipart'. Configures binary transfer.",
      "additionalProperties": false,
      "properties": {
        "source_bytes": {
          "type": "string",
          "description": "Placeholder or fn call resolving to a Buffer in shared space."
        },
        "content_type": {
          "type": "string",
          "description": "MIME type of the file being sent. May be a {{placeholder}}."
        },
        "file_name": {
          "type": "string",
          "description": "Filename to declare. May be a {{placeholder}}. Used in multipart Content-Disposition."
        },
        "file_field": {
          "type": "string",
          "description": "multipart only: the form field name for the file part. Default: 'file'.",
          "default": "file"
        },
        "fields": {
          "description": "multipart only: metadata fields to prepend before the file part. Object or {{placeholder}} resolving to an object.",
          "type": "string"
        },
        "idempotency_key": {
          "type": "string",
          "description": "Dot-path into response metadata (ctx.output.meta) whose value uniquely identifies this binary content. Used by receiveAttachment to skip re-processing already-seen files."
        }
      }
    },
    "auth": {
      "type": "object",
      "description": "Authentication block. Resolved by the engine before each request.",
      "required": ["type"],
      "additionalProperties": false,
      "properties": {
        "type": {
          "type": "string",
          "enum": ["basic", "api_key", "bearer", "oauth2_client_credentials", "custom"]
        },
        "user":          { "type": "string" },
        "pass":          { "type": "string" },
        "header":        { "type": "string" },
        "value":         { "type": "string" },
        "token":         { "type": "string" },
        "token_url":     { "type": "string" },
        "client_id":     { "type": "string" },
        "client_secret": { "type": "string" },
        "scope":         { "type": "string" },
        "token_buffer":  { "type": "number", "default": 60 },
        "on_401":        { "type": "string", "enum": ["refresh_and_retry"] },
        "resolver":      { "type": "string" }
      }
    },
    "request": {
      "type": "object",
      "required": ["type", "endpoint"],
      "additionalProperties": false,
      "properties": {
        "type":     { "type": "string", "enum": ["GET", "POST", "PUT", "PATCH", "DELETE"] },
        "endpoint": { "type": "string" },
        "headers":  { "type": "object", "additionalProperties": { "type": "string" } },
        "query":    { "type": "object", "additionalProperties": true },
        "body":     { "description": "Ignored when body_type is 'binary' or 'multipart'." }
      }
    },
    "validation": { "type": "string" },
    "filter":     { "type": "string" },
    "output":     { "type": "string" },
    "resolver":   { "type": "string" }
  }
}
